{
  "job_id": "JD-02",
  "run_id": "run_jd02",
  "as_of": "2026-10-01",
  "results": [
    {
      "file": "I1_hr_generalist_id.pdf",
      "status": "SCORED",
      "band": "A",
      "score": 100.0,
      "raw_score": 100.0,
      "recommendation": "SHORTLIST",
      "requirement_states": {
        "R1": "STRONG",
        "R2": "STRONG",
        "R3": "STRONG",
        "R4": "STRONG",
        "R5": "STRONG",
        "R6": "STRONG",
        "R7": "STRONG"
      },
      "metrics": {
        "backend_months": 58.0
      },
      "flags": [],
      "reasons": [],
      "rank": 1
    },
    {
      "file": "I2_accountant_id.docx",
      "status": "SCORED",
      "band": "C",
      "score": 0.0,
      "raw_score": 0.0,
      "recommendation": "LOW_PRIORITY",
      "requirement_states": {
        "R1": "NOT_DEMONSTRATED",
        "R2": "NOT_DEMONSTRATED",
        "R3": "NOT_DEMONSTRATED",
        "R4": "NOT_DEMONSTRATED",
        "R5": "NOT_DEMONSTRATED",
        "R6": "NOT_DEMONSTRATED",
        "R7": "NOT_DEMONSTRATED"
      },
      "metrics": {
        "backend_months": 0.0
      },
      "flags": [],
      "reasons": [],
      "rank": 14
    },
    {
      "file": "I3_graphic_designer_two_column_en.pdf",
      "status": "SCORED",
      "band": "C",
      "score": 0.0,
      "raw_score": 0.0,
      "recommendation": "LOW_PRIORITY",
      "requirement_states": {
        "R1": "NOT_DEMONSTRATED",
        "R2": "NOT_DEMONSTRATED",
        "R3": "NOT_DEMONSTRATED",
        "R4": "NOT_DEMONSTRATED",
        "R5": "NOT_DEMONSTRATED",
        "R6": "NOT_DEMONSTRATED",
        "R7": "NOT_DEMONSTRATED"
      },
      "metrics": {
        "backend_months": 0.0
      },
      "flags": [
        "HIDDEN_TEXT"
      ],
      "reasons": [],
      "rank": 13
    },
    {
      "file": "I4_sales_executive_id.pdf",
      "status": "SCORED",
      "band": "C",
      "score": 10.0,
      "raw_score": 10.0,
      "recommendation": "LOW_PRIORITY",
      "requirement_states": {
        "R1": "NOT_DEMONSTRATED",
        "R2": "NOT_DEMONSTRATED",
        "R3": "NOT_DEMONSTRATED",
        "R4": "NOT_DEMONSTRATED",
        "R5": "STRONG",
        "R6": "NOT_DEMONSTRATED",
        "R7": "NOT_DEMONSTRATED"
      },
      "metrics": {
        "backend_months": 0.0
      },
      "flags": [],
      "reasons": [],
      "rank": 7
    },
    {
      "file": "I5_nurse_scan_id.pdf",
      "status": "SCORED",
      "band": "C",
      "score": 0.0,
      "raw_score": 0.0,
      "recommendation": "LOW_PRIORITY",
      "requirement_states": {
        "R1": "NOT_DEMONSTRATED",
        "R2": "NOT_DEMONSTRATED",
        "R3": "NOT_DEMONSTRATED",
        "R4": "NOT_DEMONSTRATED",
        "R5": "NOT_DEMONSTRATED",
        "R6": "NOT_DEMONSTRATED",
        "R7": "NOT_DEMONSTRATED"
      },
      "metrics": {
        "backend_months": 0.0
      },
      "flags": [],
      "reasons": [],
      "rank": 15
    },
    {
      "file": "M1_nodejs_backend_two_column.pdf",
      "status": "SCORED",
      "band": "C",
      "score": 10.0,
      "raw_score": 10.0,
      "recommendation": "LOW_PRIORITY",
      "requirement_states": {
        "R1": "NOT_DEMONSTRATED",
        "R2": "STRONG",
        "R3": "NOT_DEMONSTRATED",
        "R4": "NOT_DEMONSTRATED",
        "R5": "NOT_DEMONSTRATED",
        "R6": "NOT_DEMONSTRATED",
        "R7": "NOT_DEMONSTRATED"
      },
      "metrics": {
        "backend_months": 0.0
      },
      "flags": [
        "HIDDEN_TEXT",
        "KEYWORD_STUFFING"
      ],
      "reasons": [],
      "rank": 5
    },
    {
      "file": "M2_data_analyst_id.pdf",
      "status": "SCORED",
      "band": "C",
      "score": 5.0,
      "raw_score": 5.0,
      "recommendation": "LOW_PRIORITY",
      "requirement_states": {
        "R1": "NOT_DEMONSTRATED",
        "R2": "PARTIAL",
        "R3": "NOT_DEMONSTRATED",
        "R4": "NOT_DEMONSTRATED",
        "R5": "NOT_DEMONSTRATED",
        "R6": "NOT_DEMONSTRATED",
        "R7": "NOT_DEMONSTRATED"
      },
      "metrics": {
        "backend_months": 0.0
      },
      "flags": [
        "KEYWORD_STUFFING"
      ],
      "reasons": [],
      "rank": 10
    },
    {
      "file": "M3_fresh_graduate_scan_id.pdf",
      "status": "SCORED",
      "band": "C",
      "score": 5.0,
      "raw_score": 5.0,
      "recommendation": "LOW_PRIORITY",
      "requirement_states": {
        "R1": "NOT_DEMONSTRATED",
        "R2": "PARTIAL",
        "R3": "NOT_DEMONSTRATED",
        "R4": "NOT_DEMONSTRATED",
        "R5": "NOT_DEMONSTRATED",
        "R6": "NOT_DEMONSTRATED",
        "R7": "NOT_DEMONSTRATED"
      },
      "metrics": {
        "backend_months": 0.0
      },
      "flags": [],
      "reasons": [],
      "rank": 12
    },
    {
      "file": "M4_qa_automation_en.docx",
      "status": "SCORED",
      "band": "C",
      "score": 5.0,
      "raw_score": 5.0,
      "recommendation": "LOW_PRIORITY",
      "requirement_states": {
        "R1": "NOT_DEMONSTRATED",
        "R2": "PARTIAL",
        "R3": "NOT_DEMONSTRATED",
        "R4": "NOT_DEMONSTRATED",
        "R5": "NOT_DEMONSTRATED",
        "R6": "NOT_DEMONSTRATED",
        "R7": "NOT_DEMONSTRATED"
      },
      "metrics": {
        "backend_months": 0.0
      },
      "flags": [],
      "reasons": [],
      "rank": 11
    },
    {
      "file": "M5_php_fullstack_two_column_id.pdf",
      "status": "SCORED",
      "band": "C",
      "score": 10.0,
      "raw_score": 10.0,
      "recommendation": "LOW_PRIORITY",
      "requirement_states": {
        "R1": "NOT_DEMONSTRATED",
        "R2": "STRONG",
        "R3": "NOT_DEMONSTRATED",
        "R4": "NOT_DEMONSTRATED",
        "R5": "NOT_DEMONSTRATED",
        "R6": "NOT_DEMONSTRATED",
        "R7": "NOT_DEMONSTRATED"
      },
      "metrics": {
        "backend_months": 0.0
      },
      "flags": [
        "HIDDEN_TEXT"
      ],
      "reasons": [],
      "rank": 9
    },
    {
      "file": "S1_senior_backend_id.pdf",
      "status": "SCORED",
      "band": "C",
      "score": 10.0,
      "raw_score": 10.0,
      "recommendation": "LOW_PRIORITY",
      "requirement_states": {
        "R1": "NOT_DEMONSTRATED",
        "R2": "STRONG",
        "R3": "NOT_DEMONSTRATED",
        "R4": "NOT_DEMONSTRATED",
        "R5": "NOT_DEMONSTRATED",
        "R6": "NOT_DEMONSTRATED",
        "R7": "NOT_DEMONSTRATED"
      },
      "metrics": {
        "backend_months": 0.0
      },
      "flags": [
        "KEYWORD_STUFFING"
      ],
      "reasons": [],
      "rank": 6
    },
    {
      "file": "S2_backend_fintech_en.pdf",
      "status": "SCORED",
      "band": "C",
      "score": 10.0,
      "raw_score": 10.0,
      "recommendation": "LOW_PRIORITY",
      "requirement_states": {
        "R1": "NOT_DEMONSTRATED",
        "R2": "STRONG",
        "R3": "NOT_DEMONSTRATED",
        "R4": "NOT_DEMONSTRATED",
        "R5": "NOT_DEMONSTRATED",
        "R6": "NOT_DEMONSTRATED",
        "R7": "NOT_DEMONSTRATED"
      },
      "metrics": {
        "backend_months": 0.0
      },
      "flags": [
        "KEYWORD_STUFFING"
      ],
      "reasons": [],
      "rank": 8
    },
    {
      "file": "S3_backend_mixed_lang.pdf",
      "status": "SCORED",
      "band": "C",
      "score": 10.0,
      "raw_score": 10.0,
      "recommendation": "LOW_PRIORITY",
      "requirement_states": {
        "R1": "NOT_DEMONSTRATED",
        "R2": "STRONG",
        "R3": "NOT_DEMONSTRATED",
        "R4": "NOT_DEMONSTRATED",
        "R5": "NOT_DEMONSTRATED",
        "R6": "NOT_DEMONSTRATED",
        "R7": "NOT_DEMONSTRATED"
      },
      "metrics": {
        "backend_months": 0.0
      },
      "flags": [
        "KEYWORD_STUFFING"
      ],
      "reasons": [],
      "rank": 3
    },
    {
      "file": "S4_lead_backend_two_column.pdf",
      "status": "SCORED",
      "band": "C",
      "score": 10.0,
      "raw_score": 10.0,
      "recommendation": "LOW_PRIORITY",
      "requirement_states": {
        "R1": "NOT_DEMONSTRATED",
        "R2": "STRONG",
        "R3": "NOT_DEMONSTRATED",
        "R4": "NOT_DEMONSTRATED",
        "R5": "NOT_DEMONSTRATED",
        "R6": "NOT_DEMONSTRATED",
        "R7": "NOT_DEMONSTRATED"
      },
      "metrics": {
        "backend_months": 0.0
      },
      "flags": [
        "HIDDEN_TEXT",
        "KEYWORD_STUFFING"
      ],
      "reasons": [],
      "rank": 4
    },
    {
      "file": "S5_backend_healthtech_id.docx",
      "status": "SCORED",
      "band": "C",
      "score": 10.0,
      "raw_score": 10.0,
      "recommendation": "LOW_PRIORITY",
      "requirement_states": {
        "R1": "NOT_DEMONSTRATED",
        "R2": "STRONG",
        "R3": "NOT_DEMONSTRATED",
        "R4": "NOT_DEMONSTRATED",
        "R5": "NOT_DEMONSTRATED",
        "R6": "NOT_DEMONSTRATED",
        "R7": "NOT_DEMONSTRATED"
      },
      "metrics": {
        "backend_months": 0.0
      },
      "flags": [],
      "reasons": [],
      "rank": 2
    }
  ]
}